{
  "formatVersion": 1,
  "executable": "v4-guards",
  "apiVersion": "1.0",
  "commands": [
    { "id": "version", "syntax": "v4-guards version", "stability": "stable", "mutability": "read-only", "requiredRoots": [] },
    { "id": "contract.validate", "syntax": "v4-guards contract validate --package-root <path> --schema <id> --document <path>", "stability": "stable", "mutability": "read-only", "requiredRoots": ["PackageRoot"] },
    { "id": "stage.run", "syntax": "v4-guards stage run --stage <bootstrap|analysis|pre|post> --package-root <path> --target-root <path> --state-root <path> --evidence-root <path> --profile <id> [--with-dependencies]", "stability": "stable", "mutability": "state-write", "requiredRoots": ["PackageRoot", "TargetRoot", "StateRoot", "EvidenceRoot"] },
    { "id": "reset.project", "syntax": "v4-guards reset project --mode <preview|apply> --package-root <path> --state-root <path> --evidence-root <path> --project <id> [--accept-manifest-hash <sha256>]", "stability": "stable", "mutability": "accepted-apply", "requiredRoots": ["PackageRoot", "StateRoot", "EvidenceRoot"] },
    { "id": "reset.factory", "syntax": "v4-guards reset factory --mode <preview|apply> --package-root <path> --state-root <path> --evidence-root <path> [--accept-manifest-hash <sha256>]", "stability": "stable", "mutability": "accepted-apply", "requiredRoots": ["PackageRoot", "StateRoot", "EvidenceRoot"] },
    { "id": "plan.validate", "syntax": "v4-guards plan validate --package-root <path> --target-root <path> --plan <path>", "stability": "stable", "mutability": "read-only", "requiredRoots": ["PackageRoot", "TargetRoot"] },
    { "id": "plan.compose", "syntax": "v4-guards plan compose --package-root <path> --target-root <path> --evidence-root <path> --id <id> --plan <path>... --output <path>", "stability": "stable", "mutability": "state-write", "requiredRoots": ["PackageRoot", "TargetRoot", "EvidenceRoot"] },
    { "id": "state.bind", "syntax": "v4-guards state bind --package-root <path> --target-root <path> --state-root <path> --evidence-root <path> --profile <id>", "stability": "experimental", "mutability": "state-write", "requiredRoots": ["PackageRoot", "TargetRoot", "StateRoot", "EvidenceRoot"] },
    { "id": "state.put", "syntax": "v4-guards state put --package-root <path> --state-root <path> --evidence-root <path> --project <id> --relative-path <path> --content <text>", "stability": "experimental", "mutability": "state-write", "requiredRoots": ["PackageRoot", "StateRoot", "EvidenceRoot"] },
    { "id": "state.recover", "syntax": "v4-guards state recover --package-root <path> --state-root <path> --evidence-root <path>", "stability": "experimental", "mutability": "state-write", "requiredRoots": ["PackageRoot", "StateRoot", "EvidenceRoot"] },
    { "id": "spike.run", "syntax": "v4-guards spike run --package-root <path> --target-root <path> --state-root <path> --evidence-root <path> --module synthetic-probe", "stability": "experimental", "mutability": "state-write", "requiredRoots": ["PackageRoot", "TargetRoot", "StateRoot", "EvidenceRoot"] },
    { "id": "profile.discover", "syntax": "v4-guards profile discover --package-root <path> --target-root <path>", "stability": "experimental", "mutability": "read-only", "requiredRoots": ["PackageRoot", "TargetRoot"] },
    { "id": "profile.draft", "syntax": "v4-guards profile draft --package-root <path> --target-root <path> --state-root <path> --profile <new-id>", "stability": "experimental", "mutability": "state-write", "requiredRoots": ["PackageRoot", "TargetRoot", "StateRoot"] },
    { "id": "profile.configure", "syntax": "v4-guards profile configure --package-root <path> --target-root <path> --state-root <path> --draft <path> --candidate <path>", "stability": "experimental", "mutability": "state-write", "requiredRoots": ["PackageRoot", "TargetRoot", "StateRoot"] },
    { "id": "profile.review-template", "syntax": "v4-guards profile review-template --package-root <path> --target-root <path> --state-root <path> --draft <configured-draft-path>", "stability": "experimental", "mutability": "state-write", "requiredRoots": ["PackageRoot", "TargetRoot", "StateRoot"] },
    { "id": "application.preview", "syntax": "v4-guards application preview --operation <setup|protection|authorities|lifecycle> --package-root <path> --target-root <path> --state-root <path> --evidence-root <path> --plan-root <relative-path>", "stability": "experimental", "mutability": "preview", "requiredRoots": ["PackageRoot", "TargetRoot", "StateRoot", "EvidenceRoot"] },
    { "id": "application.setup-progress", "syntax": "v4-guards application setup-progress --project-id <id> --package-root <path> --target-root <path> --state-root <path> --evidence-root <path> --plan-root <relative-path>", "stability": "experimental", "mutability": "read-only", "requiredRoots": ["PackageRoot", "TargetRoot", "StateRoot", "EvidenceRoot"] },
    { "id": "application.setup-action", "syntax": "v4-guards application setup-action --operation <step> --mode <preview|apply> --project-id <id> [typed choices] --package-root <path> --target-root <path> --state-root <path> --evidence-root <path> --plan-root <relative-path>", "stability": "experimental", "mutability": "state-write", "requiredRoots": ["PackageRoot", "TargetRoot", "StateRoot", "EvidenceRoot"] }
  ],
  "exitCategories": [
    { "id": "success", "code": 0 },
    { "id": "invalid-input", "code": 10 },
    { "id": "unsafe-path", "code": 11 },
    { "id": "integrity-failure", "code": 12 },
    { "id": "capability-denied", "code": 13 },
    { "id": "adapter-failure", "code": 14 },
    { "id": "prerequisite-missing", "code": 15 },
    { "id": "findings-blocking", "code": 16 },
    { "id": "state-conflict", "code": 17 },
    { "id": "reset-refused", "code": 18 },
    { "id": "internal-error", "code": 19 }
  ]
}
